{
  "schemaVersion": "molit.controlled-vocabulary-registry/1",
  "profileVersion": "1.0.0-rc.1",
  "registryStatus": "candidate-pending-authority-approval",
  "asOf": "2026-07-13",
  "lifecycleSemantics": {
    "validFrom": "Date on which the entry was admitted to this profile registry; it is not an assertion about the authority's original issue date unless the source record supplies dct:issued.",
    "nullValidTo": "No end date is recorded in this candidate snapshot.",
    "nullReplacedBy": "No replacement is recorded; this does not prevent later deprecation."
  },
  "categoryCounts": {
    "coordinate-reference-system": 10,
    "dataspace-offering-readiness": 6,
    "domestic-identifiers-and-licences": 10,
    "molit-domain": 14,
    "network-edition": 1,
    "network-element-type": 8,
    "network-lifecycle": 4,
    "quality-semantics": 14,
    "quality-status-and-metric": 10,
    "qudt-measurement-unit": 10,
    "spatial-disclosure": 6,
    "term-governance": 3,
    "transport-measurement-unit": 2,
    "transport-observation": 20
  },
  "registries": [
    {
      "iri": "http://qudt.org/vocab/unit",
      "source": {
        "artifact": "vocabulary/qudt-unit-allowlist.ttl",
        "authorities": [
          "https://qudt.org/3.4.0/vocab/unit"
        ]
      },
      "status": "externally-maintained"
    },
    {
      "iri": "http://www.opengis.net/def/crs",
      "source": {
        "artifact": "vocabulary/ogc-crs-allowlist.ttl",
        "authorities": [
          "https://www.opengis.net/def/crs/"
        ]
      },
      "status": "externally-maintained"
    },
    {
      "iri": "https://data.molit.go.kr/candidate/scheme/administrative-area",
      "source": {
        "artifact": "vocabulary/domestic-candidate-registries.ttl",
        "authorities": [
          "https://data.molit.go.kr/candidate/scheme/"
        ]
      },
      "status": "candidate"
    },
    {
      "iri": "https://data.molit.go.kr/candidate/scheme/kogl-license",
      "source": {
        "artifact": "vocabulary/domestic-candidate-registries.ttl",
        "authorities": [
          "https://data.molit.go.kr/candidate/scheme/",
          "https://www.kogl.or.kr/info/license.do"
        ]
      },
      "status": "candidate"
    },
    {
      "iri": "https://data.molit.go.kr/candidate/scheme/legal-resource",
      "source": {
        "artifact": "vocabulary/domestic-candidate-registries.ttl",
        "authorities": [
          "https://data.molit.go.kr/candidate/scheme/"
        ]
      },
      "status": "candidate"
    },
    {
      "iri": "https://data.molit.go.kr/candidate/scheme/network-edition",
      "source": {
        "artifact": "vocabulary/network-edition.ttl",
        "authorities": [
          "https://www.its.go.kr/nodelink/nodelinkRef"
        ]
      },
      "status": "candidate"
    },
    {
      "iri": "https://data.molit.go.kr/candidate/scheme/organization",
      "source": {
        "artifact": "vocabulary/domestic-candidate-registries.ttl",
        "authorities": [
          "https://data.molit.go.kr/candidate/scheme/"
        ]
      },
      "status": "candidate"
    },
    {
      "iri": "https://data.molit.go.kr/scheme/domain",
      "source": {
        "artifact": "vocabulary/molit-domain.ttl",
        "authorities": [
          "https://data.molit.go.kr/scheme/domain"
        ]
      },
      "status": "candidate"
    },
    {
      "iri": "https://data.molit.go.kr/scheme/missing-value-policy",
      "source": {
        "artifact": "vocabulary/observation-semantics.ttl",
        "authorities": [
          "https://data.molit.go.kr/scheme/"
        ]
      },
      "status": "candidate"
    },
    {
      "iri": "https://data.molit.go.kr/scheme/network-element-type",
      "source": {
        "artifact": "vocabulary/network-element-type.ttl",
        "authorities": [
          "https://data.molit.go.kr/scheme/network-element-type"
        ]
      },
      "status": "candidate"
    },
    {
      "iri": "https://data.molit.go.kr/scheme/network-lifecycle-status",
      "source": {
        "artifact": "vocabulary/network-lifecycle-status.ttl",
        "authorities": [
          "https://data.molit.go.kr/scheme/network-lifecycle-status"
        ]
      },
      "status": "candidate"
    },
    {
      "iri": "https://data.molit.go.kr/scheme/observation-aggregation",
      "source": {
        "artifact": "vocabulary/observation-semantics.ttl",
        "authorities": [
          "https://data.molit.go.kr/scheme/"
        ]
      },
      "status": "candidate"
    },
    {
      "iri": "https://data.molit.go.kr/scheme/observation-subject-type",
      "source": {
        "artifact": "vocabulary/observation-semantics.ttl",
        "authorities": [
          "https://data.molit.go.kr/scheme/"
        ]
      },
      "status": "candidate"
    },
    {
      "iri": "https://data.molit.go.kr/scheme/observed-property",
      "source": {
        "artifact": "vocabulary/observation-semantics.ttl",
        "authorities": [
          "https://data.molit.go.kr/scheme/"
        ]
      },
      "status": "candidate"
    },
    {
      "iri": "https://data.molit.go.kr/scheme/offering-readiness-status",
      "source": {
        "artifact": "vocabulary/offering-readiness-status.ttl",
        "authorities": [
          "https://data.molit.go.kr/scheme/offering-readiness-status"
        ]
      },
      "status": "candidate"
    },
    {
      "iri": "https://data.molit.go.kr/scheme/quality-evaluation-method",
      "source": {
        "artifact": "vocabulary/quality-semantics.ttl",
        "authorities": [
          "https://data.molit.go.kr/scheme/"
        ]
      },
      "status": "candidate"
    },
    {
      "iri": "https://data.molit.go.kr/scheme/quality-loss-disposition",
      "source": {
        "artifact": "vocabulary/quality-semantics.ttl",
        "authorities": [
          "https://data.molit.go.kr/scheme/"
        ]
      },
      "status": "candidate"
    },
    {
      "iri": "https://data.molit.go.kr/scheme/quality-metric",
      "source": {
        "artifact": "vocabulary/quality.ttl",
        "authorities": [
          "https://data.molit.go.kr/scheme/"
        ]
      },
      "status": "candidate"
    },
    {
      "iri": "https://data.molit.go.kr/scheme/quality-result-kind",
      "source": {
        "artifact": "vocabulary/quality-semantics.ttl",
        "authorities": [
          "https://data.molit.go.kr/scheme/"
        ]
      },
      "status": "candidate"
    },
    {
      "iri": "https://data.molit.go.kr/scheme/quality-status",
      "source": {
        "artifact": "vocabulary/quality.ttl",
        "authorities": [
          "https://data.molit.go.kr/scheme/"
        ]
      },
      "status": "candidate"
    },
    {
      "iri": "https://data.molit.go.kr/scheme/spatial-disclosure-level",
      "source": {
        "artifact": "vocabulary/spatial-disclosure-level.ttl",
        "authorities": [
          "https://data.molit.go.kr/scheme/spatial-disclosure-level"
        ]
      },
      "status": "candidate"
    },
    {
      "iri": "https://data.molit.go.kr/scheme/term-status",
      "source": {
        "artifact": "vocabulary/term-status.ttl",
        "authorities": [
          "https://data.molit.go.kr/scheme/term-status"
        ]
      },
      "status": "candidate"
    },
    {
      "iri": "https://data.molit.go.kr/scheme/transport-unit",
      "source": {
        "artifact": "vocabulary/transport-unit.ttl",
        "authorities": [
          "http://qudt.org/3.4.0/vocab/unit",
          "https://data.molit.go.kr/scheme/transport-unit"
        ]
      },
      "status": "candidate"
    }
  ],
  "entries": [
    {
      "category": "coordinate-reference-system",
      "iri": "http://inspire.ec.europa.eu/glossary/SpatialReferenceSystem",
      "notation": "SpatialReferenceSystem",
      "preferredLabel": [
        {
          "language": "en",
          "value": "Spatial reference system"
        },
        {
          "language": "ko",
          "value": "공간 좌표참조체계"
        }
      ],
      "replacedBy": null,
      "scheme": "http://www.opengis.net/def/crs",
      "source": {
        "artifact": "vocabulary/ogc-crs-allowlist.ttl",
        "authorities": [
          "https://www.opengis.net/def/crs/"
        ]
      },
      "status": "externally-maintained",
      "validFrom": "2026-07-13",
      "validTo": null
    },
    {
      "category": "qudt-measurement-unit",
      "iri": "http://qudt.org/vocab/unit/DAY",
      "notation": "DAY",
      "preferredLabel": [
        {
          "language": "en",
          "value": "day"
        }
      ],
      "replacedBy": null,
      "scheme": "http://qudt.org/vocab/unit",
      "source": {
        "artifact": "vocabulary/qudt-unit-allowlist.ttl",
        "authorities": [
          "https://qudt.org/3.4.0/vocab/unit"
        ]
      },
      "status": "externally-maintained",
      "validFrom": "2026-07-13",
      "validTo": null
    },
    {
      "category": "qudt-measurement-unit",
      "iri": "http://qudt.org/vocab/unit/HR",
      "notation": "HR",
      "preferredLabel": [
        {
          "language": "en",
          "value": "hour"
        }
      ],
      "replacedBy": null,
      "scheme": "http://qudt.org/vocab/unit",
      "source": {
        "artifact": "vocabulary/qudt-unit-allowlist.ttl",
        "authorities": [
          "https://qudt.org/3.4.0/vocab/unit"
        ]
      },
      "status": "externally-maintained",
      "validFrom": "2026-07-13",
      "validTo": null
    },
    {
      "category": "qudt-measurement-unit",
      "iri": "http://qudt.org/vocab/unit/KiloM-PER-HR",
      "notation": "KiloM-PER-HR",
      "preferredLabel": [
        {
          "language": "en",
          "value": "kilometre per hour"
        }
      ],
      "replacedBy": null,
      "scheme": "http://qudt.org/vocab/unit",
      "source": {
        "artifact": "vocabulary/qudt-unit-allowlist.ttl",
        "authorities": [